to attract,verb,"Word not found. Suggestions: tuataras, attract, tea trays",,,
album,noun,"a book for holding a collection of items (such as photographs, stamps, or coins) on pages that are initially blank",,,
attraction,noun,"the act, process, or power of attracting",,,
alcohol,noun,ethanol especially when considered as the intoxicating agent in fermented and distilled liquors,,,
authority,noun,"power to influence or command thought, opinion, or behavior",,,
alcoholic,adjective / noun,"of, relating to, or caused by alcohol",,,
average,adjective / noun,"a single value (such as a mean, mode, or median) that summarizes or represents the general significance of a set of unequal values",,,
alternative,adjective / noun,offering or expressing a choice,,,
award / to award,noun / verb,Definition unavailable.,,,
amazed,adjective,feeling or showing great surprise or wonder,,,
aware,adjective,"having or showing realization, perception, or knowledge",,,
ambition,noun,"an ardent desire for rank, fame, or power",,,
backwards,adverb,toward the back or rear,,,
block / to block,noun / verb,Word not found. Suggestions: new kid on the block,,,
to bake,verb,"Word not found. Suggestions: Toa Baja, to blame, tobiko",,,
to board,verb,to start over,,,
balance / to balance,noun / verb,"Word not found. Suggestions: balance of trade, sense of balance, balance a/the budget",,,
bomb / to bomb,noun / verb,Definition unavailable.,,,
ban / to ban,noun / verb,"Word not found. Suggestions: brings to bear, bringing to bear",,,
booking,noun,the act of one that books,,,
bank (river),noun,"Word not found. Suggestions: bank rate, drunk driver, blank verse",,,
border,noun,an outer part or edge,,,
base / to base,noun / verb,Definition unavailable.,,,
to bother,verb,"Word not found. Suggestions: top-tier, no other, top drawer",,,
basic,adjective,"of, relating to, or forming the base or essence : fundamental",,,
branch,noun,a natural subdivision of a plant stem; especially : a secondary shoot or stem (such as a bough) arising from a main axis (as of a tree),,,
battery,noun,the act of beating someone or something with successive blows : the act of battering,,,
brand,noun,a charred piece of wood,,,
battle,noun,a hostile encounter between opposing military forces —sometimes used before another noun,,,
brave,adjective,"having or showing mental or moral strength to face danger, fear, or difficulty : having or showing courage",,,
beauty,noun,"the quality or group of qualities in a person or thing that gives pleasure to the senses or the mind : loveliness; often, specifically : the quality of being physically attractive —often used before another noun",,,
breath,noun,air filled with a fragrance or odor,,,
bee,noun,"any of numerous hymenopterous insects (superfamily Apoidea) that differ from the related wasps especially in the heavier hairier body and in having sucking as well as chewing mouthparts, that feed on pollen and nectar, and that store both and often also honey",,,
to breathe,verb,"Word not found. Suggestions: the breadline, to weather, to death",,,
behaviour,noun,Definition unavailable.,,,
breathing,noun,either of the marks ' and ʼ used in writing Greek to indicate aspiration or its absence,,,
belief,noun,a state or habit of mind in which trust or confidence is placed in some person or thing,,,
bride,noun,a woman just married or about to be married,,,
bell,noun,a hollow metallic device that gives off a reverberating sound when struck,,,
bubble,noun,a small globule that is typically hollow and light: such as,,,
to bend,verb,"Word not found. Suggestions: Tobin, to hand, top-end",,,
to burst,verb,very much,,,
to benefit,verb,of help : beneficial,,,
to bury,verb,"Word not found. Suggestions: tow bar, tilbury, Tibur",,,
to bite,verb,to cause problems for one at a later time,,,
calm,adjective,"a period or condition of freedom from storms, high winds, or rough activity of water",,,
communication,noun,"the act or process of using words, sounds, signs, or behavior to express or exchange information or to express thoughts, feelings, etc., to another person",,,
campaign,noun,a connected series of military operations forming a distinct phase of a war,,,
comparison,noun,the act or process of comparing: such as,,,
campus,noun,"the grounds and buildings of a university, college, or school",,,
competitor,noun,one that competes: such as,,,
candidate,noun,"one that aspires to or is nominated or qualified for an office, membership, or award",,,
competitive,adjective,"relating to, characterized by, or based on competition",,,
cap,noun,a head covering especially with a visor and no brim,,,
complaint,noun,"expression of grief, pain, or dissatisfaction",,,
captain,noun,a military leader : the commander of a unit or a body of troops,,,
complex,adjective,a whole made up of complicated or interrelated parts,,,
career,noun,a profession for which one trains and which is undertaken as a permanent calling —often used before another noun,,,
to concentrate,verb,"Word not found. Suggestions: be concentrated, deconcentrate, reconcentrate",,,
careless,adjective,not to care —used positively and negatively with the same meaning,,,
to conclude,verb,"Word not found. Suggestions: conclude, concluded, occlude",,,
category,noun,any of several fundamental and distinct classes to which entities or concepts belong,,,
confident,adjective,full of conviction : certain,,,
ceiling,noun,the overhead inside lining of a room,,,
to confirm,verb,"Word not found. Suggestions: the converse, disconfirm, reconfirm",,,
celebration,noun,to recognize a notable event (such as a birthday or anniversary) by doing something special or enjoyable,,,
to confuse,verb,"Word not found. Suggestions: the converse, confuse, unconfuse",,,
central,adjective,containing or constituting a center,,,
confused,adjective,being perplexed or disconcerted,,,
century,noun,a period of 100 years; specifically : one of the 100-year divisions of the Christian era or of the preceding period of human history,,,
connection,noun,the act of connecting : the state of being connected: such as,,,
ceremony,noun,"a formal act or series of acts prescribed by ritual, protocol, or convention",,,
to contact / contact,verb / noun,Word not found. Suggestions: noncompetitive contract,,,
chain,noun,"a series of usually metal links or rings connected to or fitted into one another and used for various purposes (such as support, restraint, transmission of mechanical power, or measurement)",,,
container,noun,one that contains: such as,,,
challenge / to challenge,noun / verb,Word not found. Suggestions: rise to the challenge,,,
content,noun,something contained —usually used in plural,,,
champion,noun,a winner of first prize or first place in competition; also : one who shows marked superiority,,,
continuous,adjective,"marked by uninterrupted extension in space, time, or sequence",,,
channel,noun,the bed where a natural stream of water runs,,,
contrast / to contrast,noun / verb,"Word not found. Suggestions: compare and contrast, cutthroat contract",,,
chapter,noun,a main division of a book,,,
convenient,adjective,suited to personal comfort or to easy performance,,,
charge / to charge,noun / verb,"Word not found. Suggestions: free of charge, at no charge, carrying charge",,,
to convince,verb,"Word not found. Suggestions: the converse, reconvince, convince",,,
to cheat,verb,"Word not found. Suggestions: touched, to heart, touche",,,
copper,noun,a metallic chemical element with atomic number 29 that is easily formed into sheets and wires and is one of the best known conductors of heat and electricity —often used before another noun,,,
cheerful,adjective,full of good spirits : merry,,,
costume,noun,"the prevailing fashion in coiffure, jewelry, and apparel of a period, country, or class",,,
chemical,noun / adjective,"of, relating to, used in, or produced by chemistry or the phenomena of chemistry",,,
cottage,noun,the dwelling of a farm laborer or small farmer,,,
chest,noun,a container for storage or shipping; especially : a box with a lid used especially for the safekeeping of belongings,,,
cotton,noun,a soft usually white fibrous substance composed of the hairs surrounding the seeds of various erect freely branching tropical plants (genus Gossypium) of the mallow family,,,
childhood,noun,the state or period of being a child,,,
countryside,noun,a rural area,,,
to claim / claim,verb / noun,Definition unavailable.,,,
court,noun,the residence or establishment of a sovereign or similar dignitary,,,
click / to click,noun / verb,Word not found. Suggestions: chick flick,,,
cover / to cover,noun / verb,from beginning to end,,,
client,noun,one that is under the protection of another : dependent,,,
covered,adjective,to guard from attack,,,
close,adjective,to move so as to bar passage through something,,,
to create,verb,"Word not found. Suggestions: to great effect, co-create, tax credit",,,
cloth,noun,"a pliable material made usually by weaving, felting, or knitting natural or synthetic fibers and filaments",,,
credit,noun,reliance on the truth or reality of something,,,
clue,noun,something that guides through an intricate procedure or maze of difficulties; specifically : a piece of evidence that leads toward the solution of a problem,,,
cruel,adjective,disposed to inflict pain or suffering : devoid of humane feelings,,,
coach (sports/life),noun,Definition unavailable.,,,
cultural,adjective,of or relating to culture or culturing,,,
coal,noun,a piece of glowing carbon or charred wood : ember,,,
culture,noun,"the beliefs, customs, arts, etc. of a particular social group, place, or time",,,
collection,noun,the act or process of collecting,,,
currency,noun,circulation as a medium of exchange,,,
coloured,adjective,Definition unavailable.,,,
current,adjective,occurring in or existing at the present time,,,
to combine,verb,"Word not found. Suggestions: recombine, combine, to come",,,
currently,adverb,at the present time,,,
to comment,verb,"Word not found. Suggestions: the Commons, to come, touch-me-not",,,
curtain,noun,a hanging screen usually capable of being drawn back or up; especially : window drapery,,,
commercial,adjective / noun,occupied with or engaged in commerce or work intended for commerce,,,
custom,noun,a usage or practice common to many or to a particular place or class or habitual with an individual,,,
to commit,verb,"Word not found. Suggestions: to come, commit, recommit",,,
damage / to damage,noun / verb,Definition unavailable.,,,
directly,adverb,in a direct manner,,,
to deal,verb,"Word not found. Suggestions: the deal, to death, total",,,
dirt,noun,excrement,,,
decade,noun,a group or set of 10 : such as,,,
disadvantage,noun,"loss or damage especially to reputation, credit, or finances : detriment",,,
to decorate,verb,"Word not found. Suggestions: to the core, redecorate, decorate",,,
disappointed,adjective,defeated in expectation or hope,,,
deer,noun,"any of various slender-legged, even-toed, ruminant mammals (family Cervidae, the deer family) having usually brownish fur and deciduous antlers borne by the males of nearly all and by the females only of the caribou : cervid",,,
disappointing,adjective,failing to meet expectations,,,
definite,adjective,"free of all ambiguity, uncertainty, or obscurity",,,
discount,noun,a reduction made from the gross amount or value of something: such as,,,
to deliver,verb,"Word not found. Suggestions: on delivery, nondelivery, outdeliver",,,
to discuss,verb,"Word not found. Suggestions: the discus, rediscuss, discuss",,,
departure,noun,the act or an instance of departing,,,
to dislike,verb,"Word not found. Suggestions: dislike, disklike, mislike",,,
desktop,noun,the top surface of a desk; also : an area or window on a computer screen in which icons are arranged in a manner analogous to objects on top of a desk,,,
to divide,verb,"Word not found. Suggestions: redivide, subdivide, divide",,,
despite,preposition,in spite of,,,
documentary,noun,being or consisting of documents : contained or certified in writing,,,
destination,noun,a place to which one is journeying or to which something is sent,,,
to donate,verb,"Word not found. Suggestions: titanate, odonate, to date",,,
determined,adjective,having reached a decision : firmly resolved,,,
doubt / to doubt,noun / verb,Word not found. Suggestions: call into doubt,,,
development,noun,"the act, process, or result of developing",,,
dressed,adjective,to make or set straight,,,
diagram,noun,a graphic design that explains rather than represents; especially : a drawing that shows arrangement and relations (as of parts),,,
drunk,adjective,Definition unavailable.,,,
diamond,noun,"native crystalline carbon that is the hardest known mineral, that is usually nearly colorless, that when transparent and free from flaws is highly valued as a precious stone, and that is used industrially especially as an abrasive; also : a piece of this substance",,,
due,adjective,owed or owing as a debt,,,
difficulty,noun,"the quality or state of being hard to do, deal with, or understand : the quality or state of being difficult",,,
dust,noun,fine particles of matter (as of earth),,,
direct,verb / adjective,"to cause to turn, move, or point undeviatingly or to follow a straight course",,,
duty,noun,conduct due to parents and superiors : respect,,,
earthquake,noun,a shaking or trembling of the earth that is volcanic or tectonic in origin,,,
entertainment,noun,amusement or diversion provided especially by performers,,,
eastern,adjective,"of, relating to, or characteristic of a region conventionally designated East",,,
entrance,noun,power or permission to enter : admission,,,
economic,adjective,"of, relating to, or based on the production, distribution, and consumption of goods and services",,,
entry,noun,the right or privilege of entering : entrée,,,
economy,noun,"the structure or conditions of economic life in a country, area, or period; also : an economic system",,,
environment,noun,"the circumstances, objects, or conditions by which one is surrounded : the factors and influences that affect the growth, health, progress, functioning, etc., of someone or something",,,
edge,noun,the cutting side of a blade,,,
environmental,adjective,"the circumstances, objects, or conditions by which one is surrounded : the factors and influences that affect the growth, health, progress, functioning, etc., of someone or something",,,
editor,noun,someone who edits especially as an occupation,,,
episode,noun,a usually brief unit of action in a dramatic or literary work: such as,,,
to educate,verb,"Word not found. Suggestions: to taste, miseducate, reeducate",,,
equal,adjective,"of the same measure, quantity, amount, or number as another",,,
educated,adjective,having an education; especially : having an education beyond the average,,,
equally,adverb,in an equal or uniform manner : evenly,,,
educational,adjective,the action or process of teaching or of being or becoming educated; also : a stage of such a process,,,
to escape,verb,"Word not found. Suggestions: toe cap, townscape, toe caps",,,
effect,noun,"something that inevitably follows an antecedent (such as a cause or agent) : result, outcome",,,
essential,adjective,"of, relating to, or constituting essence:",,,
effective,adjective,"producing a decided, decisive, or desired effect",,,
event,noun,something that happens : occurrence,,,
effectively,adverb,in an effective manner,,,
eventually,adverb,at an unspecified later time : in the end,,,
effort,noun,conscious exertion of power : hard work,,,
to examine,verb,"Word not found. Suggestions: to his mind, examine, token money",,,
election,noun,an act or process of electing,,,
exchange / to exchange,noun / verb,"Word not found. Suggestions: exchange student, rates of exchange, exchange students",,,
embarrassed,adjective,feeling or showing a state of self-conscious confusion and distress,,,
excitement,noun,something that excites or rouses,,,
embarrassing,adjective,causing a feeling of self-conscious confusion and distress : causing embarrassment,,,
exhibition,noun,an act or instance of exhibiting,,,
emergency,noun,an unforeseen combination of circumstances or the resulting state that calls for immediate action,,,
to expand,verb,"Word not found. Suggestions: take pains, to hand, expand",,,
emotion,noun,a conscious mental reaction (such as anger or fear) subjectively experienced as strong feeling usually directed toward a specific object and typically accompanied by physiological and behavioral changes in the body,,,
expected,adjective,to consider probable or certain,,,
employment,noun,"use, purpose",,,
expedition,noun,a journey or excursion undertaken for a specific purpose,,,
to encourage,verb,"Word not found. Suggestions: tonsure, encourage, overencourage",,,
experienced,adjective,made skillful or wise through experience : practiced,,,
enemy,noun,"one that is antagonistic to another; especially : one seeking to injure, overthrow, or confound an opponent",,,
to explode,verb,"Word not found. Suggestions: took place, explode, take place",,,
engaged,adjective,"involved in activity : occupied, busy",,,
to explore,verb,"Word not found. Suggestions: took place, reexplore, take place",,,
engineering,noun,the activities or function of an engineer,,,
explosion,noun,the act or an instance of exploding,,,
to entertain,verb,"Word not found. Suggestions: tenderloin, entertain, tendering",,,
export / to export,noun / verb,Definition unavailable.,,,
to face,verb,within each other's sight or presence,,,
flood / to flood,noun / verb,"Word not found. Suggestions: blood brotherhood, blood brotherhoods",,,
fact,noun,"something that actually exists or occurs : an actual event, situation, etc. —often used in the phrase the fact that",,,
flour,noun,a product consisting of finely milled wheat; also : a similar product made from another grain or food product (such as dried potatoes or fish),,,
fairly,adverb,in a handsome manner,,,
flow / to flow,noun / verb,"Word not found. Suggestions: flown in the face of, go with the flow",,,
familiar,adjective,a member of the household of a high official,,,
fog,noun,vapor condensed to fine particles of water suspended in the lower atmosphere that differs from cloud only in being near the ground,,,
to fancy,verb,"Word not found. Suggestions: fancy, to match, to hand",,,
to fold,verb,"Word not found. Suggestions: the fold, twofold, the Flood",,,
fascinating,adjective,extremely interesting or charming : captivating,,,
folk,noun,people generally,,,
fashionable,adjective,"conforming to the custom, fashion, or established mode",,,
following,adjective / preposition,being next in order or time,,,
to fasten,verb,"Word not found. Suggestions: two-fisted, to taste, to date",,,
force / to force,noun / verb,"Word not found. Suggestions: force of nature, fields of force, field of force",,,
favour,noun,Definition unavailable.,,,
forever,adverb,for a limitless time : for all time,,,
fear / to fear,noun / verb,"Word not found. Suggestions: no need to fear, cross to bear, bring to bear",,,
frame,noun,"the physical makeup of an animal and especially a human body : physique, figure",,,
feature / to feature,noun / verb,"Word not found. Suggestions: return to nature, get back to nature",,,
to freeze,verb,"Word not found. Suggestions: to a frazzle, postfreeze, freeze",,,
to feed,verb,a person (such as a child) who needs to be fed,,,
frequently,adverb,at frequent or short intervals,,,
fence,noun,a means of protection : defense,,,
friendship,noun,the state of being friends,,,
fighting,noun,"designed, intended, or trained to fight in combat",,,
to frighten,verb,"Word not found. Suggestions: tovarishes, to rights, tovariches",,,
figure,noun,"a number symbol : numeral, digit",,,
frightened,adjective,feeling fear : made to feel afraid,,,
file / to file,noun / verb,Word not found. Suggestions: tall order to fill,,,
frightening,adjective,causing fear,,,
financial,adjective,relating to finance or financiers,,,
frozen,adjective,"treated, affected, or crusted over by freezing",,,
fine (penalty),noun,"Word not found. Suggestions: minor penalty, minor penalties",,,
to fry,verb,concerns or interests to pursue —usually used with other,,,
fitness,noun,the quality or state of being fit,,,
fuel,noun,a material used to produce heat or power by burning,,,
fixed,adjective,securely placed or fastened : stationary,,,
function / to function,noun / verb,"Word not found. Suggestions: rational function, discriminant function, rational functions",,,
flash,noun,to give off light suddenly or in quick bursts,,,
fur,noun,"to cover, line, trim, or clothe with fur",,,
garage,noun,a shelter or repair shop for automotive vehicles,,,
global,adjective,"of, relating to, or involving the entire world : worldwide",,,
to gather,verb,"Word not found. Suggestions: together, to weather, toaster",,,
glove,noun,a covering for the hand having separate sections for each of the fingers and the thumb and often extending part way up the arm,,,
generally,adverb,in a general manner: such as,,,
goods,noun,"something that possesses desirable qualities, promotes success, health, or happiness, or is otherwise beneficial",,,
generation,noun,a body of living beings constituting a single step in the line of descent from an ancestor,,,
grade,noun,"a level of study in an elementary, middle, or secondary school that is completed by a student during one year",,,
generous,adjective,liberal in giving : openhanded,,,
to graduate,verb,"Word not found. Suggestions: nongraduate, nongraduates, postgraduate",,,
gentle,adjective,"free from harshness, sternness, or violence",,,
grain,noun,a single small hard seed,,,
gentleman,noun,a man of noble or gentle birth,,,
grateful,adjective,appreciative of benefits received : feeling or showing thanks,,,
ghost,noun,the seat of life or intelligence : soul,,,
growth,noun,a stage in the process of growing : size,,,
giant,noun / adjective,a legendary humanlike being of great stature and strength,,,
guard / to guard,noun / verb,Word not found. Suggestions: guard of honor,,,
gig,noun,a job usually for a specified time; especially : an entertainer's engagement,,,
guilty,adjective,justly chargeable with or responsible for a usually grave breach of conduct or a crime,,,
glad,adjective,"experiencing pleasure, joy, or delight : made happy",,,
to hang,verb,something (such as a fact or issue) that is used as support or a reason for something said or done,,,
historic,adjective,historical: such as,,,
happiness,noun,a state of well-being and contentment : joy,,,
historical,adjective,"of, relating to, or having the character of history",,,
hardly,adverb,—used to emphasize a minimal amount or degree,,,
honest,adjective,"free from fraud or deception : legitimate, truthful",,,
headline,noun,words set at the head of a passage or page to introduce or categorize,,,
honey,noun,a sweet viscid material elaborated out of the nectar of flowers in the honey sac of various bees,,,
heating,noun,to become warm or hot,,,
horrible,adjective,"marked by or arousing painful and intense fear, dread, dismay, or aversion : marked by or arousing horror",,,
heavily,adverb,to a great degree : severely,,,
horror,noun,"painful and intense fear, dread, or dismay",,,
helicopter,noun,an aircraft whose lift is derived from the aerodynamic forces acting on one or more powered rotors turning about substantially vertical axes,,,
host / to host,noun / verb,"Word not found. Suggestions: a hostage to fortune, come home to roost",,,
to highlight,verb,"Word not found. Suggestions: highlight, torchlight, highlights",,,
however,adverb,in whatever manner or way that,,,
highly,adverb,"in or to a high place, level, or rank",,,
to hunt,verb,"Word not found. Suggestions: to hand, foxhunt, Thant",,,
to hire,verb,"Word not found. Suggestions: to heart, for hire, tocher",,,
hurricane,noun,"a tropical cyclone with winds of 74 miles (119 kilometers) per hour or greater that is usually accompanied by rain, thunder, and lightning, and that sometimes moves into temperate latitudes",,,
hint / to hint,noun / verb,"Word not found. Suggestions: hand to hand, hinge joint, point up something",,,
ignorant,adjective,destitute of knowledge or education; also : lacking knowledge or comprehension of the thing specified —often used with of or about,,,
indoor,adjective,of or relating to the interior of a building,,,
to ignore,verb,"Word not found. Suggestions: ignore, signore, monsignori",,,
indoors,adverb,in or into a building,,,
illegal,adjective,"not according to or authorized by law : contrary to or in violation of a law : unlawful, illicit; also : not sanctioned by official rules (as of a game)",,,
infant,noun,a child in the first period of life,,,
imaginary,adjective,existing only in imagination : lacking factual reality,,,
influence / to influence,noun / verb,"Word not found. Suggestions: under the influence, drive under the influence, spheres of influence",,,
immediate,adjective,"occurring, acting, or accomplished without loss or interval of time : instant",,,
ingredient,noun,something that enters into a compound or is a component part of any combination or mixture : constituent,,,
immigrant,noun,one that immigrates: such as,,,
to injure,verb,"Word not found. Suggestions: the injured, noninjury, tonsure",,,
impact,noun,the act or force especially of one body striking another,,,
injured,adjective,to inflict bodily hurt on,,,
import / to import,noun / verb,Definition unavailable.,,,
innocent,adjective,free from legal guilt or fault; also : lawful,,,
importance,noun,the quality or state of being important : consequence,,,
intelligence,noun,the ability to learn or understand things or to deal with new or difficult situations : reason,,,
impression,noun,the effect produced by impressing: such as,,,
to intend,verb,"Word not found. Suggestions: tinting, contend, tainting",,,
impressive,adjective,"making or tending to make a marked impression : having the power to excite attention, awe, or admiration",,,
