spectacular,adjective,"of, relating to, or being a spectacle : striking, sensational",,,
to satisfy,verb,"Word not found. Suggestions: toasts, satisfy, toastiest",,,
spectator,noun,one who looks on or watches,,,
saving,noun,preservation from danger or destruction : deliverance,,,
to speculate,verb,"Word not found. Suggestions: to speak of, speculate, nonspeculative",,,
scale,noun,an instrument or machine for weighing,,,
speculation,noun,an act or instance of speculating: such as,,,
scandal,noun,a circumstance or action that offends propriety or established moral conceptions or disgraces those associated with it,,,
spice,noun,"a plant product (such as pepper, nutmeg, cinnamon, or ginger) that is used to season or flavor foods and is usually comprised of seeds, fruits, bark, or rhizomes that have been dried and typically ground",,,
to scare,verb,"Word not found. Suggestions: took care, to scale, T square",,,
to spill,verb,"Word not found. Suggestions: toxophily, to scale, spill",,,
scholar,noun,a person who attends a school or studies under a teacher : pupil,,,
spiritual,adjective,"of, relating to, consisting of, or affecting the spirit : incorporeal",,,
scholarship,noun,a grant-in-aid to a student (as by a college or foundation),,,
in spite of,preposition,in defiance or contempt of : without being prevented by,,,
to scratch,verb,good enough : as good as expected or wanted —usually used in negative statements,,,
to split,verb,"Word not found. Suggestions: topples, stock split, topple",,,
to scream,verb,"Word not found. Suggestions: the cream, to shreds, touch screen",,,
to spoil,verb,"Word not found. Suggestions: toxophily, spoil, despoil",,,
screening,noun,the act or process of one that screens,,,
spokesman,noun,a person who speaks as the representative of another or others often in a professional capacity : spokesperson,,,
sector,noun,a geometric figure bounded by two radii and the included arc of a circle,,,
spokesperson,noun,a person who speaks as the representative of another or others often in a professional capacity—called also spokesman,,,
to secure,verb,"Word not found. Suggestions: takes care, nonsecure, the seashore",,,
spokeswoman,noun,a woman who speaks as the representative of another or others often in a professional capacity,,,
to seek,verb,"Word not found. Suggestions: the sick, to sleep, tow sack",,,
sponsor / to sponsor,noun / verb,Definition unavailable.,,,
seeker,noun,to resort to : go to,,,
sponsorship,noun,one who presents a candidate for baptism or confirmation and undertakes responsibility for the person's religious education or spiritual welfare,,,
to select,verb,"Word not found. Suggestions: tousles, select, to sleep",,,
stable,adjective,a building in which domestic animals are sheltered and fed; especially : such a building having stalls or compartments,,,
selection,noun,the act or process of selecting : the state of being selected,,,
stall,noun,a compartment for a domestic animal in a stable or barn,,,
self,noun,an individual's typical character or behavior,,,
stance,noun,station,,,
seminar,noun,a group of advanced students studying under a professor with each doing original research and all exchanging results through reports and discussions,,,
to stare,verb,"Word not found. Suggestions: the story, to scale, Tatar",,,
senior,adjective / noun,a person older than another,,,
to starve,verb,"Word not found. Suggestions: toaster oven, be starved, toasters",,,
sensitive,adjective,sensory,,,
statistic,noun,a single term or datum in a collection of statistics,,,
sequence,noun,a hymn in irregular meter between the gradual and Gospel in masses for special occasions (such as Easter),,,
status,noun,"position or rank when compared to others in a society, organization, group, etc.",,,
session,noun,a meeting or series of meetings of a body (such as a court or legislature) for the transaction of business,,,
steadily,adverb,direct or sure in movement : unfaltering,,,
to settle,verb,something bad that was done to someone that the harmed person keeps in mind in order to do something bad in return,,,
steady,adjective,direct or sure in movement : unfaltering,,,
settler,noun,one that settles something,,,
steam,noun,a vapor arising from a heated substance,,,
severe,adjective,"strict in judgment, discipline, or government",,,
steel,noun,"commercial iron that contains carbon in any amount up to about 1.7 percent as an essential alloying constituent, is malleable when under suitable conditions, and is distinguished from cast iron by its malleability and lower carbon content",,,
severely,adverb,"strict in judgment, discipline, or government",,,
steep,adjective,"lofty, high —used chiefly of a sea",,,
sexy,adjective,sexually suggestive or stimulating : erotic,,,
sticky,adjective,adhesive,,,
shade,noun,comparative darkness or obscurity produced when something blocks the light of the sun,,,
stiff,adjective,not easily bent : rigid,,,
shadow,noun,the dark figure cast upon a surface by a body intercepting the rays from a source of light,,,
to stimulate,verb,"Word not found. Suggestions: toastmaster, restimulate, stimulate",,,
shallow,adjective,having little depth,,,
stock,noun,a store or supply accumulated or available; especially : the inventory of goods of a merchant or manufacturer,,,
shame,noun,"a painful emotion caused by consciousness of guilt, shortcoming, or impropriety",,,
stream,noun,a body of running water (such as a river or creek) flowing on the earth; also : any body of flowing fluid (such as water or gas),,,
shaped,adjective,"form, create; especially : to give a particular form or shape to",,,
to strengthen,verb,"Word not found. Suggestions: toaster oven, restrengthen, the string section",,,
shelter,noun,something that covers or affords protection,,,
to stretch,verb,"Word not found. Suggestions: the stretch, at a stretch, to start with",,,
shooting,noun,the act of shooting a gun,,,
strict,adjective,stringent in requirement or control,,,
shore,noun,the land bordering a usually large body of water; specifically : coast,,,
strictly,adverb,stringent in requirement or control,,,
short-term,adjective,occurring over or involving a relatively short period of time,,,
strike / to strike,noun / verb,"Word not found. Suggestions: strike it rich, stride for stride, strikes it rich",,,
shortage,noun,"lack, deficit",,,
striking,adjective,attracting attention or notice through unusual or conspicuous qualities,,,
shortly,adverb,in a few words : briefly,,,
stroke,noun,to rub gently in one direction; also : caress,,,
sibling,noun,sib; also : one of two or more individuals having one common parent,,,
to struggle,verb,"Word not found. Suggestions: the story goes, struggle, power struggle",,,
sidewalk,noun,a usually paved walk for pedestrians at the side of a street,,,
stunning,adjective,causing astonishment or disbelief,,,
signature,noun,the name of a person written or affixed by that person,,,
to submit,verb,"Word not found. Suggestions: to his benefit, submit, re-submit",,,
significance,noun,something that is conveyed as a meaning often obscurely or indirectly,,,
substance,noun,essential nature : essence,,,
significant,adjective,having meaning; especially : full of import : suggestive,,,
suburb,noun,an outlying part of a city or town,,,
significantly,adverb,in a significant manner : to a significant degree,,,
suffering,noun,the state or experience of one that suffers,,,
silence,noun,forbearance from speech or noise : muteness —often used interjectionally,,,
sufficient,adjective,enough to meet the needs of a situation or a proposed end,,,
silk,noun,a fine continuous protein fiber produced by various insect larvae usually for cocoons; especially : a lustrous tough elastic fiber produced by silkworms and used for textiles,,,
sufficiently,adverb,enough to meet the needs of a situation or a proposed end,,,
sincere,adjective,free of dissimulation : honest,,,
sum,noun,an indefinite or specified amount of money,,,
skilled,adjective,having acquired mastery of or skill in something (such as a technique or a trade),,,
super,adjective,of high grade or quality,,,
skull,noun,the skeleton of the head of a vertebrate forming a bony or cartilaginous case that encloses and protects the brain and chief sense organs and supports the jaws,,,
surgeon,noun,a medical specialist who practices surgery : a physician trained and qualified to perform surgical procedures,,,
slave,noun,"someone captured, sold, or born into chattel slavery",,,
surgery,noun,a branch of medicine concerned with diseases and conditions requiring or amenable to operative or manual procedures,,,
to slide,verb,"Word not found. Suggestions: tousled, to size, toggled",,,
to surround,verb,"Word not found. Suggestions: to ground, surround, the ground",,,
slight,adjective,having a slim or delicate build : not stout or massive in body,,,
surrounding,adjective,to enclose on all sides : envelop,,,
to slip,verb,"Word not found. Suggestions: to sleep, nonslip, tousled",,,
survival,noun,the act or fact of living or continuing longer than another person or thing,,,
slogan,noun,a war cry especially of a Scottish clan,,,
survivor,noun,to remain alive or in existence : live on,,,
slope,noun,that slants : sloping —often used in combination,,,
suspect / to suspect,noun / verb,Definition unavailable.,,,
so-called,adjective,commonly named,,,
to suspend,verb,"Word not found. Suggestions: resuspend, suspend, in suspense",,,
solar,adjective,"of, derived from, relating to, or caused by the sun",,,
sustainability,noun,capable of being sustained,,,
somehow,adverb,in one way or another not known or designated : by some means,,,
sustainable,adjective,capable of being sustained,,,
sometime,adverb,at some time in the future,,,
to swallow,verb,"Word not found. Suggestions: to scale, tree swallow, swallow",,,
somewhat,adverb,something,,,
to swear,verb,"Word not found. Suggestions: tosser, no sweat, toucher",,,
sophisticated,adjective,deprived of native or original simplicity: such as,,,
to sweep,verb,"Word not found. Suggestions: toss-up, to sleep, go to sleep",,,
soul,noun,"the immaterial essence, animating principle, or actuating cause of an individual life",,,
symbol,noun,an authoritative summary of faith or doctrine : creed,,,
source,noun,a generative force : cause,,,
to symbolise,verb,"Word not found. Suggestions: symbolise, symbolize, symbolised",,,
spare,adjective,not being used; especially : held for emergency use,,,
sympathetic,adjective,"existing or operating through an affinity, interdependence, or mutual association",,,
specialise,verb,Definition unavailable.,,,
sympathy,noun,a feeling or expression of sincere concern for someone who is experiencing something difficult or painful; also : the capacity for this,,,
specialist,noun,"one who specializes in a particular occupation, practice, or field of study",,,
tag / to tag,noun / verb,"Word not found. Suggestions: take to task, taking to task, taken to task",,,
thumb,noun,"the short thick digit of the human hand that is analogous in position to the big toe and differs from the other fingers in having only two phalanges, allowing greater freedom of movement, and being opposable to each of them",,,
tale,noun,a usually imaginative narrative of an event : story,,,
thus,adverb,in this or that manner or way,,,
tank,noun,"a usually large receptacle for holding, transporting, or storing liquids (such as water or fuel)",,,
timing,noun,placement or occurrence in time,,,
tap / to tap,noun / verb,"Word not found. Suggestions: taking to task, taken to task, take to task",,,
tissue,noun,a piece of soft absorbent tissue paper used especially as a handkerchief or for removing cosmetics,,,
tear / to tear,noun / verb,"Word not found. Suggestions: wear and tear, reduce to tears, tear its hair",,,
tone,noun,vocal or musical sound of a specific quality; especially : musical sound with respect to timbre and manner of expression,,,
technological,adjective,"of, relating to, or characterized by technology",,,
tough,adjective,"difficult to accomplish, resolve, endure, or deal with",,,
teen,noun,a teenage person : teenager,,,
tournament,noun,"a series of games or contests that make up a single unit of competition (as on a professional golf tour), the championship playoffs of a league or conference, or an invitational event",,,
temple,noun,a building for religious practice: such as,,,
toxic,adjective,containing or being poisonous material especially when capable of causing death or serious debilitation,,,
temporarily,adverb,during a limited time,,,
trace / to trace,noun / verb,Definition unavailable.,,,
temporary,adjective,lasting for a limited time,,,
track / to track,noun / verb,"Word not found. Suggestions: tracking stock, a hard nut to crack, a tough nut to crack",,,
tendency,noun,a proneness to a particular kind of thought or action,,,
trading,noun,to give one thing in exchange for another,,,
tension,noun,"inner striving, unrest, or imbalance often with physiological indication of emotion",,,
tragedy,noun,a disastrous event : calamity,,,
terminal,noun / adjective,leading ultimately to death : fatal,,,
tragic,adjective,"regrettably serious or unpleasant : deplorable, lamentable",,,
terms,noun,"a word or expression that has a precise meaning in some uses or is peculiar to a science, art, profession, or subject",,,
trait,noun,a distinguishing quality (as of personal character),,,
terribly,adverb,"to an extreme degree : very, extremely",,,
transfer / to transfer,noun / verb,"Word not found. Suggestions: transfer stations, transfer factors, transfer factor",,,
to terrify,verb,"Word not found. Suggestions: terrify, fox terrier, to term",,,
to transform,verb,"Word not found. Suggestions: to term, transform, retransform",,,
territory,noun,a geographic area belonging to or under the jurisdiction of a governmental authority,,,
transition,noun,"a change or shift from one state, subject, place, etc. to another",,,
terror,noun,a state of intense or overwhelming fear,,,
to transmit,verb,"Word not found. Suggestions: titrant, transmit, to their amusement",,,
terrorism,noun,the systematic use of terror especially as a means of coercion,,,
trap / to trap,noun / verb,Definition unavailable.,,,
terrorist,noun,an advocate or practitioner of terrorism as a means of coercion,,,
treasure,noun,"wealth (such as money, jewels, or precious metals) stored up or hoarded",,,
testing,noun,requiring maximum effort or ability,,,
trial,noun,the formal examination before a competent tribunal of the matter in issue in a civil or criminal cause in order to determine such issue,,,
textbook,noun,a book used in the study of a subject: such as,,,
tribe,noun,"a community composed chiefly of numerous families, clans, or generations who have a shared ancestry, culture, and language —often used in the capitalized names of specific tribes",,,
theft,noun,the act of stealing; specifically : the felonious taking and removing of personal property with intent to deprive the rightful owner of it,,,
trillion,number,"a number equal to 1,000 times one billion",,,
therapist,noun,"an individual specializing in the therapeutic medical treatment of impairment, injury, disease, or disorder; especially : a health care professional trained in methods of treatment and rehabilitation other than the use of drugs or surgery",,,
troop,noun,a group of soldiers,,,
therapy,noun,"therapeutic medical treatment of impairment, injury, disease, or disorder",,,
tropical,adjective,"of, relating to, occurring in, or suitable for use in the tropics",,,
theory,noun,a scientifically acceptable or plausible general principle or body of principles based on data and offered to explain phenomena,,,
truly,adverb,in all sincerity : sincerely —often used with yours as a complimentary close (as of a letter) or humorously to refer to oneself,,,
therefore,adverb,for that reason : because of that : consequently,,,
trust / to trust,noun / verb,Definition unavailable.,,,
thorough,adjective,carried through to completion : exhaustive,,,
tsunami,noun,a great sea wave produced especially by submarine earth movement or volcanic eruption : tidal wave,,,
thoroughly,adverb,in a complete or thorough manner : to a complete or thorough extent,,,
tune,noun,a pleasing succession of musical tones : melody,,,
threat,noun,"an expression of intention to inflict evil, injury, or damage",,,
tunnel,noun,a covered passageway; specifically : a horizontal passageway through or under an obstruction,,,
to threaten,verb,"Word not found. Suggestions: titrate, moth-eaten, titrated",,,
ultimate,adjective,last in a progression or series : final,,,
unity,noun,the quality or state of not being multiple : oneness,,,
ultimately,adverb,in the end : fundamentally,,,
universal,adjective,including or covering all or a whole collectively or distributively without limit or exception; especially : available equitably to all members of a society,,,
unacceptable,adjective,not acceptable : not pleasing or welcome,,,
universe,noun,the whole body of things and phenomena observed or postulated : cosmos: such as,,,
uncertainty,noun,the quality or state of being uncertain : doubt,,,
unknown,adjective,not known,,,
unconscious,adjective,having lost consciousness,,,
upper,adjective,"higher in physical position, rank, or order",,,
to undergo,verb,"Word not found. Suggestions: the underground, go under, thunderer",,,
upwards,adverb,in a direction from lower to higher,,,
to undertake,verb,"Word not found. Suggestions: thunderstroke, undertake, thunderstrike",,,
urban,adjective,"of, relating to, characteristic of, or constituting a city",,,
unexpected,adjective,not expected : unforeseen,,,
to urge,verb,"Word not found. Suggestions: theurgy, to order, targe",,,
to unfold,verb,"Word not found. Suggestions: tenfold, fourfold, unfold",,,
urgent,adjective,calling for immediate attention : pressing,,,
unfortunate,adjective,"not favored by fortune : unsuccessful, unlucky",,,
usage,noun,firmly established and generally accepted practice or procedure,,,
unique,adjective,being the only one : sole,,,
useless,adjective,having or being of no use:,,,
to unite,verb,"Word not found. Suggestions: T-note, motor units, tenuity",,,
valid,adjective,having legal efficacy or force; especially : executed with the proper legal authority and formalities,,,
virtual,adjective,being such in essence or effect though not formally recognized or admitted,,,
variation,noun,the act or process of varying : the state or fact of being varied,,,
visa,noun,an endorsement made on a passport by the proper authorities denoting that it has been examined and that the bearer may proceed,,,
to vary,verb,"Word not found. Suggestions: tovarich, ovary, tovarish",,,
visible,adjective,capable of being seen,,,
vast,adjective,"very great in size, amount, degree, intensity, or especially in extent or range",,,
vision,noun,the act or power of seeing : sight,,,
venue,noun,locale; also : a place where events of a specific type are held,,,
visual,adjective,"of, relating to, or used in vision",,,
vertical,adjective,perpendicular to the plane of the horizon or to a primary axis : upright,,,
vital,adjective,of the utmost importance,,,
via,preposition,by way of,,,
vitamin,noun,"any of various organic substances that are essential in minute quantities to the nutrition of most animals and some plants, act especially as coenzymes and precursors of coenzymes in the regulation of metabolic processes but do not provide energy or serve as building units, and are present in natural foodstuffs or sometimes produced within the body",,,
victory,noun,the overcoming of an enemy or antagonist,,,
volume,noun,the degree of loudness or the intensity of a sound; also : loudness,,,
victorious,adjective,having won a victory,,,
voluntarily,adverb,proceeding from the will or from one's own choice or consent,,,
viewpoint,noun,"a position or perspective from which something is considered or evaluated : point of view, standpoint",,,
voluntary,adjective,proceeding from the will or from one's own choice or consent,,,
violence,noun,"the use of physical force so as to injure, abuse, damage, or destroy",,,
voting,noun,to cast or conduct a vote,,,
wage,noun,"a payment usually of money for labor or services usually according to contract and on an hourly, daily, or piecework basis —often used in plural",,,
widow,noun,a woman who has lost her spouse or partner by death and usually has not remarried,,,
to wander,verb,"Word not found. Suggestions: two-hander, no wonder, to windward",,,
wildlife,noun,"living things and especially mammals, birds, and fishes that are neither human nor domesticated",,,
warming,noun,to make warm,,,
willing,adjective,inclined or favorably disposed in mind : ready,,,
weakness,noun,the quality or state of being weak; also : an instance or period of being weak,,,
wire,noun,metal in the form of a usually very flexible thread or slender rod,,,
wealth,noun,abundance of valuable material possessions or resources,,,
wisdom,noun,ability to discern inner qualities and relationships : insight,,,
wealthy,adjective,having wealth : very affluent,,,
wise,adjective,"characterized by wisdom : marked by deep understanding, keen discernment, and a capacity for sound judgment",,,
weekly,adjective / adverb,every week : once a week : by the week,,,
to withdraw,verb,"Word not found. Suggestions: to weather, withdraw, withdraws",,,
weird,adjective,"of strange or extraordinary character : odd, fantastic",,,
witness / to witness,noun / verb,Word not found. Suggestions: witness stands,,,
welfare,noun,"the state of doing well especially in respect to good fortune, happiness, well-being, or prosperity",,,
wolf,noun,"any of several large predatory canids (genus Canis) that are active mostly at night, live and hunt in packs, and resemble the related dogs; especially : gray wolf",,,
wheat,noun,"a cereal grain that yields a fine white flour used chiefly in breads, baked goods (such as cakes and crackers), and pastas (such as macaroni or spaghetti), and is important in animal feeds",,,
workforce,noun,the workers engaged in a specific activity or enterprise,,,
whereas,conjunction,while on the contrary,,,
workplace,noun,"a place (such as an office, shop, or factory) where people work —often used before another noun",,,
wherever,conjunction,"at, in, or to any or all places that",,,
workshop,noun,a small establishment where manufacturing or handicrafts are carried on,,,
to whisper,verb,"Word not found. Suggestions: whisper, stage whisper, stage whispers",,,
worm,noun,earthworm; broadly : an annelid worm,,,
whoever,pronoun,whatever person : no matter who —used in any grammatical relation except that of a possessive,,,
wound / to wound,noun / verb,"Word not found. Suggestions: wound down, pound for pound, enough to go round",,,
whom,pronoun,—used as an interrogative or relative—used as object of a verb or a preceding preposition or less frequently as the object of a following preposition though now often considered stilted especially as an interrogative and especially in oral use—occasionally used as predicate nominative with a copulative verb or as subject of a verb especially in the vicinity of a preposition or a verb of which it might mistakenly be considered the object,,,
to wrap,verb,"Word not found. Suggestions: towrope, body wrap, the rap",,,
widely,adverb,over or through a wide area,,,
wrist,noun,the joint or the region of the joint between the human hand and the arm,,,
widespread,adjective,widely diffused or prevalent,,,
zone,noun,a region or area set off as distinct from surrounding or adjoining parts,,,
Words C1 (Advanced),Part of Speech,Basic Meaning,Status,,
to abolish,verb,"Word not found. Suggestions: to a polish, abolish, the Polish",,,
allocation,noun,to apportion for a specific purpose or to particular persons or things : distribute,,,
abortion,noun,"the termination of a pregnancy after, accompanied by, resulting in, or closely followed by the death of the embryo or fetus: such as",,,
allowance,noun,a sum granted as a reimbursement or bounty or for expenses; especially : a sum regularly provided for personal or household expenses,,,
absence,noun,"a state or condition in which something expected, wanted, or looked for is not present or does not exist : a state or condition in which something is absent",Mastered,,
ally,noun,to unite or form a connection or relation between : associate —usually used with with or to,,,
absurd,adjective,"ridiculously unreasonable, unsound, or incongruous : extremely silly or ridiculous",,,
aluminium,noun,aluminum —often used before another noun,,,
abuse / to abuse,noun / verb,Definition unavailable.,,,
amateur,noun / adjective,"one who engages in a pursuit, study, science, or sport as a pastime rather than as a profession",,,
academy,noun,a school usually above the elementary level; especially : a private high school,,,
ambassador,noun,an official envoy; especially : a diplomatic agent of the highest rank accredited to a foreign government or sovereign and appointed for a special and often temporary diplomatic assignment as the resident representative abroad,,,
to accelerate,verb,"Word not found. Suggestions: reaccelerate, accelerate, accelerated",,,
to amend,verb,"Word not found. Suggestions: towmond, to that end, tomenta",,,
acceptance,noun,the quality or state of being accepted or acceptable,,,
amendment,noun,the process of altering or amending a law or document (such as a constitution) by parliamentary or constitutional procedure,,,
accessible,adjective,capable of being reached; also : being within reach,,,
amid,preposition,in or into the middle of : surrounded by : among,,,
accomplishment,noun,the act or fact of accomplishing something : completion,,,
analogy,noun,a comparison of two otherwise unlike things based on resemblance of a particular aspect; also : one of the two things being compared,,,
accordingly,adverb,in accordance : correspondingly,,,
