Words A1 (Elementary),Part of Speech,Basic Meaning,Status,,use this for call =MW_DEFINITION(cellnum)
a / an,determiner,—used to make a statement or description less forceful or definite,Familiar,,
angry,adjective,feeling or showing anger,Mastered,,
about,preposition,reasonably close to,Mastered,,
animal,noun,"any of a kingdom (Animalia) of living things including many-celled organisms and often many of the single-celled ones (such as protozoans) that typically differ from plants in having cells without cellulose walls, in lacking chlorophyll and the capacity for photosynthesis, in requiring more complex food materials (such as proteins), in being organized to a greater degree of complexity, and in having the capacity for spontaneous movement and rapid motor responses to stimulation",Mastered,,
above,preposition,in the sky : overhead,Mastered,,
another,determiner,different or distinct from the one first considered,Mastered,,
across,preposition,"from one side to the opposite side of : over, through",Mastered,,
to answer,verb,to be responsible for many bad things that have happened,Mastered,,
action,noun,a thing done : deed,Mastered,,
answer,noun,something spoken or written in reply to a question,Mastered,,
activity,noun,the quality or state of being active : behavior or actions of a particular kind,Mastered,,
any,determiner,one or some indiscriminately of whatever kind:,Mastered,,
actor,noun,one that acts : doer,Mastered,,
anyone,pronoun,any person at all,,,
actress,noun,a woman or girl who is an actor,,,
anything,pronoun,any thing whatever : any such thing,,,
to add,verb,to immediately say something in order to prevent confusion or misunderstanding,,,
apartment,noun,a room or set of rooms fitted especially with housekeeping facilities and usually leased as a dwelling,,,
address,noun,to deal with or give attention to,,,
apple,noun,"the fleshy, usually rounded red, yellow, or green edible pome fruit of a usually cultivated tree (genus Malus) of the rose family; also : an apple tree",,,
adult,noun,fully developed and mature : grown-up,,,
April,noun,the fourth month of the Gregorian calendar,,,
afraid,adjective,filled with fear or apprehension,,,
area,noun,the surface included within a set of lines; specifically : the number of unit squares equal in measure to the surface,,,
after,preposition,"following in time or place : afterward, behind, later",,,
arm,noun,a human upper limb; especially : the part between the shoulder and the wrist,,,
afternoon,noun,the part of day between noon and sunset,,,
around,preposition,in a circle or in circumference,,,
again,adverb,another time : once more : anew,,,
arrive,verb,"Word not found. Suggestions: thrive, arrive, to a crisp",Mastered,,
age,noun,"the time of life at which some particular qualification, power, or capacity arises or rests; specifically : majority",,,
art,noun,"skill acquired by experience, study, or observation",,,
ago,adverb,earlier than the present time,,,
article,noun,a distinct often numbered section of a writing,,,
air,noun,the mixture of invisible odorless tasteless gases (such as nitrogen and oxygen) that surrounds the earth; also : the equivalent mix of gases on another celestial object (such as a planet),,,
artist,noun,"a person who creates art (such as painting, sculpture, music, or writing) using conscious skill and creative imagination",,,
airport,noun,a place from which aircraft operate that usually has paved runways and maintenance facilities and often serves as a terminal,,,
as,preposition,to the same degree or amount,,,
all,determiner,"the whole amount, quantity, or extent of",,,
ask,verb,to call on for an answer,,,
all right,adjective / adverb,"satisfactory, agreeable",,,
at,preposition,"—used as a function word to indicate presence or occurrence in, on, or near",,,
also,adverb,likewise,,,
August,noun,marked by majestic dignity or grandeur,,,
always,adverb,at all times : invariably,,,
aunt,noun,the sister of one's father or mother,,,
amazing,adjective,"causing astonishment, great wonder, or surprise",,,
autumn,noun,"the season between summer and winter comprising in the northern hemisphere usually the months of September, October, and November or as reckoned astronomically extending from the September equinox to the December solstice —called also fall",,,
and,conjunction,—used as a function word to indicate connection or addition especially of items within the same class or type—used to join sentence elements of the same grammatical rank or function,,,
away,adverb,on the way : along,,,
baby,noun,an extremely young child; especially : infant —sometimes used of an adult daughter or son to express parental nostalgia or affection,,,
black,adjective,having the very dark color of the night sky or the eye's pupil : of the color black,,,
back,adverb,the rear part of the human body especially from the neck to the end of the spine,,,
blog,noun,"a website that contains online personal reflections, comments, and often hyperlinks, videos, and photographs provided by the writer; also : the contents of such a site",,,
bad,adjective,failing to reach an acceptable standard : poor,,,
blonde,adjective,"of a flaxen, golden, light auburn, or pale yellowish-brown color; also : having blond hair",,,
bag,noun,"a usually flexible container that may be closed for holding, storing, or carrying something: such as",,,
blue,adjective,of the color whose hue is that of the clear sky : of the color blue,,,
ball,noun,a round or roundish body or mass: such as,,,
boat,noun,a small vessel for travel on water,,,
banana,noun,an elongated usually tapering tropical fruit with soft pulpy flesh enclosed in a soft usually yellow rind,,,
body,noun,the main part of a plant or animal body especially as distinguished from limbs and head : trunk,,,
band,noun,a strip serving to join or hold things together: such as,,,
book,noun,a set of written sheets of skin or paper or tablets of wood or ivory,,,
bank,noun,"a mound, pile, or ridge raised above the surrounding level: such as",,,
boot,noun,deliverance,,,
bar,noun,"a straight piece (as of wood or metal) that is longer than it is wide and has any of various uses (as for a lever, support, barrier, or fastening)",,,
bored,adjective,filled with or characterized by boredom,,,
bath,noun,a washing or soaking (as in water or steam) of all or part of the body,,,
boring,adjective,causing weariness and restlessness through lack of interest : causing boredom : tiresome,,,
bathroom,noun,a room containing a bathtub or shower and usually a sink and toilet,,,
born,past participle,brought forth by or as if by birth,,,
to be,verb,that is to be : future —usually used postpositively and often in combination,,,
both,determiner,the one as well as the other,,,
beach,noun,shore pebbles : shingle,,,
bottle,noun,a rigid or semirigid container typically of glass or plastic having a comparatively narrow neck or mouth and usually no handle,,,
beautiful,adjective,having qualities of beauty : exciting aesthetic pleasure,,,
bottom,noun,the underside of something,,,
because,conjunction,for the reason that : since,,,
box,noun,a rigid typically rectangular container with or without a cover : such as,,,
to become,verb,likely to still be admired many years from now,,,
boy,noun,a male child from birth to adulthood,,,
bed,noun,a piece of furniture on or in which to lie and sleep,,,
boyfriend,noun,a frequent or regular male companion in a romantic or sexual relationship,,,
bedroom,noun,a room furnished with a bed and intended primarily for sleeping,,,
bread,noun,a usually baked and leavened food made of a mixture whose basic constituent is flour or meal,,,
beer,noun,"a carbonated, fermented alcoholic beverage that is usually made from malted cereal grain (especially barley), is flavored with hops, and typically contains less than a 5% alcohol content",,,
break,verb,"Word not found. Suggestions: tea break, tax break, tiebreak",Mastered,,
before,preposition,in advance : ahead,,,
breakfast,noun,the first meal of the day especially when taken in the morning,,,
to begin,verb,as the first thing to be considered,,,
to bring,verb,"Word not found. Suggestions: the brink, the briny, tapering",Mastered,,
beginning,noun,the point at which something begins : start,,,
brother,noun,a male who has the same parents as another or one parent in common with another,,,
behind,preposition,in the place or situation that is being or has been departed from,,,
brown,adjective,having the color of wood or chocolate; especially : of the color brown,,,
to believe,verb,"to be influenced to a certain belief because of something heard, seen, or read",,,
build,verb,"Word not found. Suggestions: Tobol, upbuild, rebuild",,,
below,preposition,in or to a lower place,,,
building,noun,a usually roofed and walled structure built for permanent use (as for a dwelling),,,
best,adjective,excelling all others,,,
bus,noun,a large motor vehicle designed to carry passengers usually along a fixed route according to a schedule,,,
better,adjective,greater than half,,,
business,noun,"a usually commercial or mercantile activity engaged in as a means of livelihood : trade, line",,,
between,preposition,by the common action of : jointly engaging,,,
busy,adjective,engaged in action : occupied,,,
bicycle,noun,"a vehicle with two wheels tandem, handlebars for steering, a saddle seat, and pedals by which it is propelled; also : a stationary exercise machine that resembles such a vehicle",,,
but,conjunction,except for the fact,,,
big,adjective,"large or great in dimensions, bulk, or extent; also : large or great in quantity, number, or amount",,,
butter,noun,"a solid emulsion of fat globules, air, and water made by churning milk or cream and used as food",,,
bike,noun,bicycle,,,
to buy,verb,a right to buy (something) in the future for a specified price,,,
bill,noun,the jaws of a bird together with their horny covering,,,
by,preposition,in proximity to : near,,,
bird,noun,the young of a feathered vertebrate,,,
bye,interjection,the position of a participant in a tournament who advances to the next round without playing,,,
birthday,noun,the day of a person's birth,,,
cafe,noun,a usually small and informal establishment serving various refreshments (such as coffee); broadly : restaurant,,,
clean,adjective,free from dirt or pollution,,,
cake,noun,a breadlike food made from a dough or batter that is usually fried or baked in small flat shapes and is often unleavened,,,
to climb,verb,"Word not found. Suggestions: touchline, rock climb, the clink",,,
to call,verb,—used to say that something belongs only to oneself,,,
clock,noun,a device other than a watch for indicating or measuring time commonly by means of hands moving on a dial; broadly : any periodic system by which time is measured,,,
camera,noun,a device that consists of a lightproof chamber with an aperture fitted with a lens and a shutter through which the image of an object is projected onto a surface for recording (as on a photosensitive film or an electronic sensor) or for translation into electrical impulses (as for television broadcast),,,
to close,verb,to come to an end,,,
can,verb,be physically or mentally able to,,,
clothes,noun,clothing,,,
cannot,verb,can not,,,
club,noun,a heavy usually tapering staff especially of wood wielded as a weapon,,,
capital,noun,"of or conforming to the series A, B, C, etc. rather than a, b, c, etc.",,,
coat,noun,an outer garment worn on the upper body and varying in length and style according to fashion and use,,,
car,noun,a vehicle moving on wheels: such as,,,
coffee,noun,"a beverage made by percolation, infusion, or decoction from the roasted and ground seeds of a coffee plant",,,
card,noun,playing card,,,
cold,adjective,having or being a temperature that is uncomfortably low for humans,,,
carrot,noun,"a biennial herb (Daucus carota of the family Apiaceae synonym Umbelliferae, the carrot family) with a usually orange spindle-shaped edible root; also : its root",,,
college,noun,an independent institution of higher learning offering a course of general studies leading to a bachelor's degree; also : a university division offering this,,,
to carry,verb,"Word not found. Suggestions: took care, miscarry, tow car",,,
colour,noun,Definition unavailable.,,,
cat,noun,a carnivorous mammal (Felis catus) long domesticated as a pet and for catching rats and mice,,,
to come,verb,existing or arriving in the future,,,
CD,noun,candela,,,
company,noun,association with another : fellowship,,,
cent,noun,"a monetary unit equal to 1/100 of a basic unit of value (such as dollar, euro, rand)",,,
to complete,verb,"Word not found. Suggestions: two's complement, auto-complete, autocomplete",,,
centre,noun,Definition unavailable.,,,
computer,noun,"one that computes; specifically : a programmable usually electronic device that can store, retrieve, and process data",,,
chair,noun,a seat typically having four legs and a back for one person,,,
concert,noun,a public performance (as of music or dancing),,,
to change,verb,affected by or possibly affected by (something),,,
to cook,verb,"Word not found. Suggestions: tough cookie, to come, tow sack",,,
chart,noun,map: such as,,,
cooking,noun,Definition unavailable.,,,
cheap,adjective,charging or obtainable at a low price,,,
cool,adjective,moderately cold : lacking in warmth,,,
to check,verb,"Word not found. Suggestions: touches, in check, teaches",,,
correct,adjective,to make or set right : amend,,,
cheese,noun,"a food consisting of the coagulated, compressed, and usually ripened curd of milk separated from the whey",,,
to cost,verb,from one's own bad experience,,,
chicken,noun,the common domestic fowl (Gallus gallus) especially when young; also : its flesh used as food,,,
could,verb,"—used in auxiliary function in the past, in the past conditional, and as an alternative to can suggesting less force or certainty or as a polite form in the present",,,
child,noun,a young person especially between infancy and puberty,,,
country,noun,an indefinite usually extended expanse of land : region,,,
chocolate,noun,a food prepared from ground roasted cacao beans,,,
course,noun,the act or action of moving in a path from point to point,,,
to choose,verb,"Word not found. Suggestions: touches, choose, tough cookie",,,
cousin,noun,a child of one's uncle or aunt,,,
cinema,noun,movie —often used before another noun,,,
cow,noun,the mature female of cattle (genus Bos),,,
city,noun,"an inhabited place of greater size, population, or importance than a town or village",,,
cream,noun,the yellowish part of milk containing from 18 to about 40 percent butterfat,,,
class,noun,a body of students meeting regularly to study the same subject,,,
cup,noun,an open usually bowl-shaped drinking vessel,,,
classroom,noun,a place where classes meet,,,
customer,noun,one that purchases a commodity or service,,,
to clean,verb,"Word not found. Suggestions: the cleaners, come clean, Tokelauan",,,
to cut,verb,"Word not found. Suggestions: took out, to a T, toss out",,,
dad,noun,a male parent : father —often used as a name,,,
difficult,adjective,"hard to do, make, or carry out : arduous",,,
daily,adjective,"occurring, made, or acted upon every day",,,
dinner,noun,the principal meal of the day,,,
to dance,verb,"Word not found. Suggestions: toe dance, toe dancer, toe dances",,,
dirty,adjective,not clean or pure,,,
dancer,noun,to move one's body rhythmically usually to music : to engage in or perform a dance,,,
dish,noun,a more or less concave vessel from which food is served,,,
dancing,noun,to move one's body rhythmically usually to music : to engage in or perform a dance,,,
to do,verb,necessary to be done,,,
dangerous,adjective,"involving possible injury, pain, harm, or loss : characterized by danger",,,
doctor,noun,"a person skilled or specializing in healing arts; especially : someone (such as a physician, dentist, or veterinarian) who holds an advanced degree and is licensed to practice",,,
dark,adjective,"devoid or partially devoid of light : not receiving, reflecting, transmitting, or radiating light",,,
dog,noun,"a carnivorous mammal (Canis familiaris) closely related to the gray wolf that has long been domesticated as a pet, occurs in a variety of sizes, colors, and coat types, and is sometimes trained to perform special tasks (such as herding, guarding, or acting as a service animal)",,,
date,noun,"the brown, oblong edible fruit of a palm (Phoenix dactylifera)",,,
dollar,noun,any of various basic monetary units (as in the U.S. and Canada),,,
daughter,noun,a female offspring especially of human parents,,,
door,noun,a usually swinging or sliding barrier by which an entry is closed and opened; also : a similar part of a piece of furniture,,,
day,noun,the time of light between one night and the next,,,
down,adverb,toward or in a lower physical position,,,
dear,adjective,highly valued : precious —often used in a salutation,,,
downstairs,adverb,down the stairs : on or to a lower floor,,,
December,noun,the 12th month of the Gregorian calendar,,,
to draw,verb,"Word not found. Suggestions: tea tray, top drawer, top drawers",,,
to decide,verb,"Word not found. Suggestions: to the side, decide, tout de suite",,,
dress,noun,to make or set straight,,,
delicious,adjective,appealing to one of the bodily senses especially of taste or smell,,,
to drink,verb,to cause someone to drink lots of alcohol,,,
desk,noun,"a table, frame, or case with a sloping or horizontal surface especially for writing and reading and often with drawers, compartments, and pigeonholes",,,
to drive,verb,"Word not found. Suggestions: co-drive, codrive, sex drive",,,
detail,noun,extended treatment of or attention to particular items,,,
driver,noun,one that drives: such as,,,
dialogue,noun,"the conversational element of literary or dramatic composition (such as a movie, play, or novel)",,,
driving,noun,communicating force,,,
dictionary,noun,"a reference source in print or electronic form containing words usually alphabetically arranged along with information about their forms, pronunciations, functions, etymologies, meanings, and syntactic and idiomatic uses",,,
dry,adjective,free or relatively free from a liquid and especially water,,,
to die,verb,extremely desirable or appealing,,,
during,preposition,throughout the duration of,,,
diet,noun,food and drink regularly provided or consumed,,,
DVD,noun,an optical disc using a high-capacity format and containing especially a video recording (such as a movie) or computer data —often used before another noun; also : the high-capacity format used on such a disk,,,
different,adjective,"partly or totally unlike in nature, form, or quality : dissimilar —often followed by from, than, or chiefly British to",,,
each,determiner,being one of two or more distinct individuals having a similar relation and often constituting an aggregate,,,
euro,noun,the common basic monetary unit of most countries of the European Union,,,
ear,noun,the characteristic vertebrate organ of hearing and equilibrium consisting in the typical mammal of a sound-collecting outer ear separated by the tympanic membrane from a sound-transmitting middle ear that in turn is separated from a sensory inner ear by membranous fenestrae,,,
even,adverb,having a horizontal surface : flat,,,
early,adjective,near the beginning of a period of time,,,
evening,noun,the latter part and close of the day and early part of the night,,,
east,noun,"to, toward, or in the east",,,
ever,adverb,always,,,
easy,adjective,causing or involving little difficulty or discomfort,,,
every,determiner,being each individual or part of a group without exception,,,
to eat,verb,"Word not found. Suggestions: toea, to heart, toeas",,,
everybody,pronoun,everyone,,,
egg,noun,the hard-shelled reproductive body produced by a bird and especially by the common domestic chicken; also : its contents used as food,,,
everyone,pronoun,every person : everybody,,,
eight,number,a number that is one more than seven,,,
everything,pronoun,all that exists,,,
eighteen,number,a number that is one more than seventeen,,,
exam,noun,examination,,,
eighty,number,a number that is equal to eight times 10,,,
example,noun,a person or way of behaving that serves as a pattern to be imitated or not to be imitated,,,
elephant,noun,"a thickset, usually extremely large, nearly hairless, herbivorous mammal (family Elephantidae, the elephant family) that has a snout elongated into a muscular trunk and two incisors in the upper jaw developed especially in the male into long ivory tusks:",,,
excited,adjective,"having, showing, or characterized by a heightened state of energy, enthusiasm, eagerness, etc. : feeling or showing excitement",,,
eleven,number,a number that is one more than 10,,,
exciting,adjective,producing excitement,,,
else,adverb,in a different manner or place or at a different time,,,
exercise,noun,the act of bringing into play or realizing in action : use,,,
email,noun,a means or system for transmitting messages electronically (as between computers on a network),,,
expensive,adjective,involving high cost or sacrifice,,,
end,noun,the part of an area that lies at the boundary,,,
to explain,verb,to immediately say something in order to prevent confusion or misunderstanding,,,
to enjoy,verb,"Word not found. Suggestions: teensy, enjoy, to die for",,,
extra,adjective,"more than is due, usual, or necessary : additional",,,
enough,determiner,"occurring in such quantity, quality, or scope as to fully meet demands, needs, or expectations",,,
eye,noun,"a specialized light-sensitive sensory structure of animals that in nearly all vertebrates, most arthropods, and some mollusks is the image-forming organ of sight; especially : the nearly spherical usually paired hollow organ of sight in vertebrates that is filled with a jellylike material, is lined with a photosensitive retina, and is lodged in a bony orbit in the skull",,,
face,noun,"the front part of the head that in humans extends from the forehead to the chin and includes the mouth, nose, cheeks, and eyes",,,
five,number,a number that is one more than four,,,
to fall,verb,"Word not found. Suggestions: the Fall, snowfall, topfull",,,
to fix,verb,"Word not found. Suggestions: toffies, to wit, topic",,,
FALSE,adjective,,,,
flat,noun,lying at full length or spread out upon the ground : prostrate,,,
family,noun,the basic unit in society traditionally consisting of two parents rearing their children; also : any of various social units differing from but regarded as equivalent to the traditional family,,,
flight,noun,an act or instance of passing through the air by the use of wings,,,
famous,adjective,widely known,,,
floor,noun,the level base of a room,,,
fantastic,adjective,based on fantasy : not real,,,
flower,noun,"the specialized part of an angiospermous plant that occurs singly or in clusters, possesses whorls of often colorful petals or sepals, and bears the reproductive structures (such as stamens or pistils) involved in the development of seeds and fruit : blossom",,,
far,adverb,at or to a considerable distance in space,,,
to fly,verb,"Word not found. Suggestions: TOEFL, pop fly, topfull",,,
farm,noun,a sum or due fixed in amount and payable at fixed intervals,,,
to follow,verb,someone or something that has been so successful that it is very difficult for the person or thing coming next to be as good,,,
farmer,noun,a person who pays a fixed sum for some privilege or source of income,,,
food,noun,"material consisting essentially of protein, carbohydrate, and fat used in the body of an organism to sustain growth, repair, and vital processes and to furnish energy; also : such food together with supplementary substances (such as minerals, vitamins, and condiments)",,,
fast,adjective,"characterized by quick motion, operation, or effect:",,,
foot,noun,the terminal part of the vertebrate leg upon which an individual stands,,,
fat,adjective,notable for having an unusual amount of fat:,,,
football,noun,"any of several games played between two teams on a usually rectangular field having goalposts or goals at each end and whose object is to get the ball over a goal line, into a goal, or between goalposts by running, passing, or kicking: such as",,,
father,noun,a male parent,,,
for,preposition,—used as a function word to indicate purpose,,,
favourite,adjective,"Word not found. Suggestions: favorite, favorites, favoured",,,
to forget,verb,"Word not found. Suggestions: the forces, to order, the Force",,,
February,noun,the second month of the Gregorian calendar,,,
form,noun,the shape and structure of something as distinguished from its material,,,
to feel,verb,"Word not found. Suggestions: TOEFL, to heel, topfull",,,
forty,number,a number equal to four times 10,,,
festival,noun,"of, relating to, appropriate to, or set apart as a festival",,,
four,number,a number that is one more than three,,,
few,determiner,not many persons or things,,,
fourteen,number,a number that is one more than 13,,,
fifteen,number,a number that is one more than fourteen,,,
fourth,number,one that is number four in a series,,,
fifth,number,one that is number five in a series,,,
free,adjective,not costing or charging anything,,,
fifty,number,a number equal to five times 10,,,
Friday,noun,the sixth day of the week,,,
to fill,verb,something that is very difficult to do,,,
friend,noun,one attached to another by affection or esteem —sometimes used ironically or humorously to refer to a person who is disliked or annoying,,,
film,noun,a thin skin or membranous covering : pellicle,,,
friendly,adjective,"of, relating to, or befitting a friend: such as",,,
final,adjective,not to be altered or undone,,,
from,preposition,—used as a function word to indicate a starting point of a physical movement or a starting point in measuring or reckoning or in a statement of limits,,,
to find,verb,to discover (a situation that one was not aware of) upon returning to a place,,,
front,noun,forehead; also : the whole face,,,
fine,adjective,all right,,,
